"Status","Start Time","Stop Time","Duration in ms","Parent Suite","Suite","Sub Suite","Test Class","Test Method","Name","Description"
"passed","Sat Oct 15 15:41:21 GMT 2022","Sat Oct 15 15:41:28 GMT 2022","6275","","com.example.tests.MainPageTest","","com.example.tests.MainPageTest","langUpperBarTest","Проверка заголовков основных разделов при выборе русского и анлийского языка Для RU отображаются кнопки основых разделов на странице [Selecty, Услуги, Карьера, Контакты]",""
"failed","Sat Oct 15 15:41:35 GMT 2022","Sat Oct 15 15:41:46 GMT 2022","11169","","com.example.tests.MainPageTest","","com.example.tests.MainPageTest","newResumeFormTest","Проверка появления окна с предупреждением о необходимости заполнения обязательных полей для отправки резюме",""
"passed","Sat Oct 15 15:41:10 GMT 2022","Sat Oct 15 15:41:21 GMT 2022","10953","","com.example.tests.MainPageTest","","com.example.tests.MainPageTest","upperBarTest","Проверка drop-down menu)",""
"passed","Sat Oct 15 15:41:28 GMT 2022","Sat Oct 15 15:41:35 GMT 2022","7204","","com.example.tests.MainPageTest","","com.example.tests.MainPageTest","langUpperBarTest","Проверка заголовков основных разделов при выборе русского и анлийского языка Для EN отображаются кнопки основых разделов на странице [Selecty, Services, Career, Contacts]",""
"passed","Sat Oct 15 15:41:46 GMT 2022","Sat Oct 15 15:41:51 GMT 2022","5214","","com.example.tests.MainPageTest","","com.example.tests.MainPageTest","videoFormTest","Проверка появления окна с видео",""
"passed","Sat Oct 15 15:41:51 GMT 2022","Sat Oct 15 15:41:58 GMT 2022","6396","","com.example.tests.MainPageTest","","com.example.tests.MainPageTest","availabilityOfPublicationTest","Проверка наличия публикаций в разделе ""СМИ о нас""",""
